{
  "policy_id": "hs-2026-0002",
  "title": "화성시 출산지원금",
  "category": "복지",
  "lifecycle": ["출산·육아"],
  "beneficiary": "가구",
  "benefit": "첫째아 100만원 / 둘째·셋째아 각 200만원 / 넷째아 이상 300만원 현금 지급 (넷째아 이상은 2회 분할지급)",
  "conditions": {
    "residence_months": { "min": 6 },
    "household": ["유자녀가구", "다자녀"]
  },
  "manual_conditions": [
    {
      "label": "화성시에 출생신고된 출생 아동이 있을 것",
      "hint": "주민등록등본 또는 가족관계증명서로 확인"
    },
    {
      "label": "출생일 기준 부 또는 모가 180일 전부터 화성시 관내에 주민등록을 두고 거주",
      "hint": "주민등록초본(주소변동이력 포함)으로 확인. 180일 미만 거주자는 출생일로부터 180일이 경과한 날까지 거주한 경우 지원 대상"
    },
    {
      "label": "재혼가정은 주민등록상 동일 세대에 등재된 자녀만 출산순위에 포함",
      "hint": "주민등록등본으로 세대 구성 확인"
    },
    {
      "label": "지급 시점까지 화성시 연속 거주 유지 (다음해 생일까지)",
      "hint": "신청 시점 요건이 아니라 지급까지 유지해야 하는 요건. 중간에 전출하면 지급되지 않을 수 있음"
    },
    {
      "label": "출생일로부터 1년 이내 신청",
      "hint": "기한 경과 시 신청 불가"
    }
  ],
  "deadline": null,
  "apply_channel": "방문 신청 — 주소지 관할 행정복지센터에서 출생신고 시 행복출산 원스톱서비스로 신청 / 온라인 — 정부24",
  "required_docs": [
    "출산지원금 신청서",
    "신청인 신분증",
    "신청인 명의 통장 사본"
  ],
  "verify_required": ["residence_months", "household"],
  "contact": "화성시 저출생대응과 031-5189-3971 / 화성시 콜센터 1577-4200 (구청별: 만세구청 돌봄복지과 031-5189-1172, 효행구청 031-5189-7652, 병점구청 031-5189-4284, 동탄구청 가정보육과 031-5189-5203)",
  "source_url": "https://www.hscity.go.kr/www/partInfo/femaleFamily/Welfare1/Welfare1_2.jsp",
  "review": {
    "parsed_by": "D",
    "reviewed_by": "B",
    "reviewed_at": "2026-08-12",
    "checklist": {
      "conditions": true,
      "deadline": true,
      "benefit": true,
      "required_docs": true,
      "apply_channel": true,
      "source_url": true,
      "conditions_complete": true
    }
  }
}
