{
  "policy_id": "hs-2025-XXXX",
  "title": "2025년 보육서비스 사전 신청 안내",
  "category": "보육",
  "lifecycle": [
    "출산·육아"
  ],
  "beneficiary": "가구",
  "benefit": "보육료, 양육수당, 유아학비 변경 및 신규신청",
  "deadline": "2025-02-28",
  "required_docs": [
    "공고 확인 필요"
  ],
  "contact": "남양읍 행정복지센터",
  "apply_channel": "읍면동 행정복지센터 방문신청, 온라인신청(www.bokjiro.go.kr), 모바일신청(복지로앱)",
  "conditions": {
    "household": [
      "제한없음"
    ]
  },
  "manual_conditions": [
    {
      "label": "보육료, 양육수당 등 자격 변경 시 반드시 신청 필요",
      "hint": "자격 변경 여부 확인"
    },
    {
      "label": "누리과정 비용은 3년을 초과하여 지원받을 수 없음",
      "hint": "누리과정 지원 기간 확인"
    }
  ],
  "exclusions": [],
  "source_url": "https://www.hscity.go.kr/byeongjeom/user/bbs/BD_selectBbs.do?q_bbsCode=1048&q_bbscttSn=20250204175711686&q_deptCode=57400150000&q_searchWhereTy=&q_searchVal=",
  "review": {
    "parsed_by": "A",
    "reviewed_by": "",
    "reviewed_at": "2026-08-10",
    "checklist": {
      "conditions": false,
      "deadline": false,
      "benefit": false,
      "required_docs": false,
      "apply_channel": false,
      "source_url": false,
      "conditions_complete": false
    }
  }
}