{
  "policy_id": "hs-2026-0042",
  "title": "화성시 청년 월세 지원",
  "category": "주거",
  "lifecycle": ["전입", "청년"],
  "beneficiary": "세대주",
  "benefit": "월 최대 20만 원, 최장 12개월",
  "conditions": {
    "age": { "min": 19, "max": 39 },
    "income_percentile": { "max": 150 },
    "residence_months": { "min": 6 },
    "household": ["1인가구", "신혼부부"]
  },
  "exclusions": ["국토부 청년월세 특별지원과 중복 수급 불가"],
  "deadline": "2026-09-30",
  "apply_channel": "온라인·시청 방문",
  "required_docs": ["주민등록등본", "소득증명원", "임대차계약서 사본"],
  "verify_required": ["income_percentile"],
  "contact": "화성시 청년정책과 031-000-0000",
  "source_url": "https://www.hscity.go.kr/example",
  "review": {
    "parsed_by": "A",
    "reviewed_by": "D",
    "reviewed_at": "2026-08-08",
    "checklist": {
      "conditions": true,
      "deadline": true,
      "benefit": true,
      "required_docs": true,
      "apply_channel": true,
      "source_url": true,
      "conditions_complete": true,
      "exclusions": true
    }
  }
}
