{
  "policy_id": "hs-2026-1249",
  "title": "[경기도일자리재단] 2026년 경기청년 맞춤형 채용지원 서비스 사업 1기 참여자 모집",
  "category": "일자리",
  "lifecycle": [
    "청년"
  ],
  "beneficiary": "본인",
  "benefit": "1:1 취업컨설팅 및 취업역량 강화 프로그램",
  "deadline": "2026-03-18",
  "required_docs": [
    "공고 확인 필요"
  ],
  "contact": "031-270-6645",
  "conditions": {
    "age": {
      "min": 18,
      "max": 39
    },
    "household": [
      "제한없음"
    ]
  },
  "manual_conditions": [
    {
      "label": "경기도 거주",
      "hint": "주민등록증 등 거주 여부 확인"
    },
    {
      "label": "미취업 청년",
      "hint": "취업 여부 확인"
    }
  ],
  "apply_channel": "온라인 신청(홈페이지 바로가기)",
  "exclusions": [],
  "source_url": "https://hey.hscity.go.kr/base/board/read?boardManagementNo=8&boardNo=1249&menuLevel=2&menuNo=95",
  "review": {
    "parsed_by": "A",
    "reviewed_by": "",
    "reviewed_at": "2026-08-12",
    "checklist": {
      "conditions": false,
      "deadline": false,
      "benefit": false,
      "required_docs": false,
      "apply_channel": false,
      "source_url": false,
      "conditions_complete": false
    }
  }
}