{
  "policy_id": "hs-2026-0001",
  "title": "화성시 성인용 보행기 지원",
  "category": "건강",
  "lifecycle": ["노후"],
  "beneficiary": "본인",
  "benefit": "1인당 최대 20만원 한도 내 보행기 실구입비 지원 (국민기초생활수급자 최대 20만원 / 차상위계층 최대 18만원, 5년 주기 1인 1회)",
  "conditions": {
    "age": { "min": 65 },
    "residence_months": { "min": 12 },
    "household": ["제한없음"]
  },
  "manual_conditions": [
    {
      "label": "「노인장기요양보험법」 제15조제2항에 따른 장기요양등급외 A 또는 B 판정, 또는 거동불편 소견이 담긴 의사진단서(소견서) 발급자",
      "hint": "장기요양등급 판정서 또는 의사 진단서(소견서)로 확인"
    },
    {
      "label": "「국민기초생활 보장법」에 따른 수급자 또는 차상위계층",
      "hint": "수급자증명서/차상위계층 확인서로 확인 — 본인이 서류 없이 답하기 어려움"
    }
  ],
  "exclusions": [
    "최근 5년 이내 「국민건강보험법」 또는 「의료급여법」 등 다른 법령 및 기타 지원사업을 통해 보행기 급여를 지원받은 자",
    "장기요양등급 인정자(1~5등급, 인지지원등급)"
  ],
  "deadline": null,
  "apply_channel": "오프라인(읍면동 행정복지센터 복지팀 방문)",
  "required_docs": ["공고 확인 필요"],
  "contact": "화성시 중장년노인과 031-5189-3849",
  "source_url": "https://www.hscity.go.kr/www/partInfo/femaleFamily/Welfare5/Welfare5_9.jsp",
  "review": {
    "parsed_by": "B",
    "reviewed_by": "A",
    "reviewed_at": "2026-08-10",
    "checklist": {
      "conditions": true,
      "deadline": true,
      "benefit": true,
      "required_docs": true,
      "apply_channel": true,
      "source_url": true,
      "conditions_complete": true,
      "exclusions": true
    }
  }
}
