{
  "policy_id": "hs-2026-0000",
  "title": "화성시 노인 보청기 지원",
  "category": "건강",
  "lifecycle": ["노후"],
  "beneficiary": "본인",
  "benefit": "1인당 최대 1,179,000원 한도 내 보청기 실구입비 지원 (생애 1회, 5년 무상 사후관리)",
  "conditions": {
    "age": { "min": 65 },
    "residence_months": { "min": 12 },
    "household": ["제한없음"]
  },
  "manual_conditions": [
    {
      "label": "최근 6개월 이내 이비인후과 전문의 난청진단 (한 귀 청력손실 40dB이상 80dB미만, 다른 귀 40dB이상 60dB미만)",
      "hint": "이비인후과 진단서로 확인"
    },
    {
      "label": "「국민기초생활 보장법」에 따른 수급자 또는 차상위계층",
      "hint": "수급자증명서/차상위계층 확인서로 확인 — 본인이 서류 없이 답하기 어려움"
    },
    {
      "label": "화성시 소재 장애인 보조기기 등록업소에서 구입",
      "hint": "구입처가 등록업소인지 사전 확인 필요"
    }
  ],
  "exclusions": ["최근 5년 이내 「국민건강보험법」 또는 「의료급여법」 등 다른 법령 및 기타 지원사업을 통해 보청기 급여를 지원받은 자"],
  "deadline": null,
  "apply_channel": "오프라인(읍면동 행정복지센터 복지팀 방문)",
  "required_docs": ["공고 확인 필요"],
  "contact": "화성시 중장년노인과 031-5189-3849",
  "source_url": "https://www.hscity.go.kr/www/partInfo/femaleFamily/Welfare5/Welfare5_9.jsp"
}
