{
  "policy_id": "hs-2026-0263",
  "title": "2026년 화성시 청년 부동산 중개보수 및 이사비 지원사업",
  "category": "주거",
  "lifecycle": ["전입", "청년"],
  "beneficiary": "본인",
  "benefit": "중개보수·이사비 포함 가구당 최대 50만원 한도 내 실비 지원 (중개보수 30만원 / 이사비 40만원 개별 한도, 생애 1회) · 지원규모 200명 (예산범위 내 추가 인원 지원 가능)",
  "conditions": {
    "age": { "min": 19, "max": 39 },
    "income_percentile": { "max": 180 },
    "household": ["제한없음"]
  },
  "manual_conditions": [
    {
      "label": "2026년도 기준 19세~39세 (1986.1.1.~2007.12.31. 출생자)",
      "hint": "공고 원문은 만 나이가 아니라 출생일 구간으로 대상을 지정한다 — 주민등록초본의 생년월일로 확인"
    },
    {
      "label": "신청일 기준 신청자 및 세대원 전원 무주택자 (입주권·분양권 보유 포함 제외)",
      "hint": "주민등록등본 기준 세대원 전원 무주택 여부 확인. 입주권·분양권 보유도 주택 소유로 간주"
    },
    {
      "label": "2025년 1월 1일 이후부터 신청일 사이 화성시로 전입 또는 화성시 내에서 이사 후 전입신고 완료",
      "hint": "주민등록초본(주소변동이력 전생애 포함)으로 확인"
    },
    {
      "label": "임대차계약서상 임차인이 신청자 본인",
      "hint": "공인중개사 날인된 임대차계약서로 확인. 고시원 등은 입실확인서+사업자등록증 사본으로 대체"
    },
    {
      "label": "임차보증금(전세 전환가액) 5억원 이하 & 임차전용면적 60㎡ 이하 (2인가구 이상 85㎡ 이하)",
      "hint": "임대차계약서로 확인. 주택·비주택(고시원 등) 모두 가능. 월세가 있는 경우 기존보증금 + 1년치 월세 × 전월세 전환율(4.75%)로 환산"
    },
    {
      "label": "객관적 지출 증빙이 가능한 거래일 것 (현금영수증·전자세금계산서 발행 가능)",
      "hint": "신용카드 결제는 카드영수증(승인번호·금액·거래일자·가맹점명 명시), 계좌이체·현금은 현금영수증 또는 전자세금계산서 + 계좌이체증. 간이영수증 인정 불가. 발행이 불가한 개인 간 거래는 지원 대상 제외"
    },
    {
      "label": "생애 1회 한정 — 기수혜자 제외",
      "hint": "기존 수혜 이력 확인"
    },
    {
      "label": "임대인이 가족관계증명서에 등재된 신청인 또는 배우자의 직계존속(부모 등)이 아닐 것",
      "hint": "가족관계증명서와 임대차계약서의 임대인 대조로 확인"
    },
    {
      "label": "국민기초생활수급권자 중 생계·의료·주거급여 수급자가 아닐 것",
      "hint": "공고 원문 기준 — 수급 여부 확인 필요"
    },
    {
      "label": "외국인 및 재외국민이 아닐 것",
      "hint": "주민등록초본으로 확인"
    },
    {
      "label": "공동생활가정 또는 사회보장시설 입소자 등 시설 수급자가 아닐 것",
      "hint": "공고 원문 기준 — 시설 입소 여부 확인 필요"
    },
    {
      "label": "사업자등록이 되지 않은 개인과 거래하지 않았을 것",
      "hint": "거래 상대방의 사업자등록 여부 확인"
    },
    {
      "label": "기타 사업 취지에 부합하지 않다고 판단되는 경우 제외",
      "hint": "공고 원문 기준 — 최종 판단은 심사 기관 재량"
    },
    {
      "label": "선정 우선순위 — (1순위) 사회적약자(자립준비청년·장애인·한부모가족)·전세피해청년·주거취약청년(지하·반지하·옥탑방·고시원 등 거주자), (2순위) 저소득 순, (3순위) 화성시 거주기간 순",
      "hint": "자격요건이 아니라 선정 기준이다. 지원규모 200명(예산범위 내 추가 가능)으로 자격을 충족해도 선정되지 않을 수 있다. 해당 시 우선선발 증빙 자료 제출 — 한부모가족은 한부모가족지원법에 따라 지정된 자, 전세피해청년은 국토부·주택도시보증공사 등의 전세피해 확인서 발급자, 자립준비청년은 보호종료확인서 발급자에 한함"
    }
  ],
  "exclusions": [
    "중앙부처·타 지자체 중개수수료 지원사업 중복수혜자 (국토교통부 '주거취약계층 주거지원사업', 타 지자체 '중개보수 및 이사비 지원사업' 수혜자 포함)"
  ],
  "deadline": "2026-03-06",
  "apply_channel": "온라인 신청 — 잡아바어플라이 통합접수시스템(apply.jobaba.net), 방문접수 불가",
  "required_docs": [
    "신청서 1부 [붙임1 서식]",
    "개인정보 수집·이용 및 제3자 제공 조회 동의서 1부 [붙임2 서식]",
    "주민등록등본 및 초본 (세대원 이름·주민등록번호·관계·전입일 포함, 초본은 주소변동이력 전생애 포함 / 정부24·읍면동 행정복지센터, 초본은 신청 사이트 마이데이터 전자동의로 대체 가능)",
    "임대차계약서 (임대인·임차인 인적사항, 임차주택소재지, 계약기간, 임차보증금, 주거전용면적, 공인중개사 날인 필수 / 고시원 등은 입실확인서[붙임3]+사업자등록증 사본)",
    "이사비 및 중개보수 지출 증빙서류 (신용카드 결제 시 카드영수증 / 계좌이체·현금 결제 시 현금영수증 또는 전자세금계산서 + 계좌이체증)",
    "가족관계증명서(일반) — 미혼은 본인 기준, 기혼은 본인 및 배우자 기준 (대법원 전자가족관계등록시스템·정부24·읍면동 행정복지센터)",
    "소득금액증명원(2024년분) — 배우자 또는 15세 이상 세대원이 있는 경우 추가 제출, 소득이 없으면 소득없음사실증명원 (정부24·국세청 홈택스·읍면동 행정복지센터)",
    "신청인 명의 신분증 및 지급통장",
    "우선선발 대상 증빙 자료 (해당 시)",
    "※ 제출서류는 공고일(2026.1.19.) 이후 발급한 서류만 인정. 전입일이 공고일 이후인 경우 전입일 이후 발급분만 인정"
  ],
  "verify_required": ["income_percentile"],
  "contact": "화성시 청년청소년정책과 청년지원팀 031-5189-6217",
  "source_url": "https://www.hscity.go.kr/town/user/bbs/BD_selectBbs.do?q_bbsCode=1048&q_bbscttSn=20260114165703844",
  "review": {
    "parsed_by": "D",
    "reviewed_by": "A",
    "reviewed_at": "2026-08-10",
    "checklist": {
      "conditions": true,
      "deadline": true,
      "benefit": true,
      "required_docs": true,
      "apply_channel": true,
      "source_url": true,
      "conditions_complete": true,
      "exclusions": true
    }
  }
}
