{
  "policy_id": "hs-2026-2594",
  "title": "화성시 청년 전(월)세 보증금 대출이자 지원사업",
  "category": "주거",
  "lifecycle": ["청년"],
  "beneficiary": "본인",
  "benefit": "대출이자 연 최대 200만 원 지원 (연 1회, 생애 최대 2회 지원 가능, 대출액의 연 2% 이자지원 — 대출이율 2% 이하 시 실질 대출금리 적용)",
  "conditions": {
    "age": { "min": 19, "max": 39 },
    "income_percentile": { "max": 180 },
    "household": ["제한없음"]
  },
  "manual_conditions": [
    { "label": "제1·2금융기관에서 전(월)세 보증금 대출 후 2024.1.1.~신청일 사이 12개월 이상 이자 상환", "hint": "대출계좌 이자 조회표로 확인" },
    { "label": "무주택자(신청 청년 본인)", "hint": "행정정보 공동이용 또는 등기부등본으로 확인 — 본인이 서류 없이 답하기 어려움" },
    { "label": "임대차계약자 및 대출명의가 신청 청년 본인이어야 함(세대주·세대원 무관)", "hint": "임대차계약서·대출확인증명서 명의 대조" },
    { "label": "신청자의 주민등록상 동일 가구원 전원(거주지를 달리하는 배우자 및 자녀 포함) 무주택자여야 함", "hint": "가족관계증명서 + 세대원 전원 무주택 확인(행정정보 공동이용) — 별거중인 배우자·자녀도 포함되는 게 핵심" },
    { "label": "보증금(전세 전환가액) 3억원 이하 & 임차전용면적 60㎡ 이하(세대원이 있는 경우 85㎡ 이하), 화성시 소재 주택 또는 주거용 오피스텔", "hint": "임대차계약서 보증금액, 건축물대장 전용면적·소재지로 확인. 월세보증금의 전세가액 변환은 전월세변환율 6.2% 적용('26년도 상반기 경기도 전월세전환율 평균)" },
    { "label": "신청일 기준 주민등록상 전입신고가 되어있는 주택에 한해 신청 가능(과거 거주 주택 신청 불가)", "hint": "주민등록등본·초본 전입일로 확인" },
    { "label": "주택소유자, 분양권 또는 조합원 입주권이 있는 사람 지원 불가", "hint": "등기부등본·분양계약서로 확인 — 본인이 정확히 판단하기 어려울 수 있음" },
    { "label": "건축물대장상 주택이 아닌 곳과 불법건축물, 다중 주택, 공공임대주택 신청 불가", "hint": "건축물대장으로 확인" },
    { "label": "대출용도가 주택 전(월)세 자금이 아닌 신용대출·일반대출 등인 경우 지원 불가", "hint": "대출계좌 이자조회표·금융거래확인서상 대출 용도로 확인" },
    { "label": "임대인이 신청인(배우자 포함)의 직계존속 및 형제·자매 등 2촌 이내 혈족인 경우 지원 불가", "hint": "임대차계약서 임대인과 신청인 가족관계 대조" },
    { "label": "외국인 및 재외국민 지원 불가", "hint": "주민등록번호·국적 확인" }
  ],
  "exclusions": [
    "기초생활보장수급자(생계, 의료, 주거급여 대상자) — 국민기초생활수급자 중 교육급여 대상자는 신청 가능",
    "정부 공공주거사업(청년 사회적 주택, 공적임대주택(청년), 농촌보금자리 조성(청년), 행복주택, 장기전세임대주택, 청년전세임대, 청년신혼부부 매입임대리츠, 신혼부부 매입임대주택(1,2형), 신혼부부 전세임대(1,2형), 청년 매입임대주택, LH국민임대주택 등) 및 공공주택특별법상 공공임대주택(공무원임대주택·분양전환된 공공임대주택 포함) 거주자 — 민간임대주택법상 민간임대주택은 지원 가능, 공공건설임대주택은 제외",
    "유사 주거지원 사업 참여자·선정자 — 2026년 상반기 청년 전(월)세 보증금 대출이자 지원사업, 화성시 신혼부부 전세자금 대출이자 지원사업, 화성시 다자녀 주택자금 대출이자 지원사업, 화성시 청년 월세 지원사업, 국토부 청년월세 지원사업(지원금 수령 중인 자)"
  ],
  "deadline": "2026-08-14",
  "apply_channel": "온라인(잡아바어플라이 통합접수시스템, apply.jobaba.net) — 방문접수 불가",
  "required_docs": [
    "신청서, 서약서 및 개인정보(제3자 제공) 동의서",
    "임대차계약서(확정일자 날인 필수, 주택임대차계약 신고필증으로 대체 가능)",
    "임차주택 등기부등본(등기사항전부증명서)",
    "주택 전월세자금 대출 확인 증명서(금융거래확인서) 및 대출계좌 이자 조회표",
    "소득금액증명원(2025년도분, 15세 이상 세대원 포함)",
    "주민등록등본 및 초본",
    "가족관계증명서(상세)",
    "신분증 사본 및 통장 사본"
  ],
  "verify_required": ["income_percentile"],
  "contact": "화성시 청년청소년과 031-5189-6217",
  "source_url": "https://apply.jobaba.net/bsns/bsnsDetailView.do?bsnsSeq=5814"
}
