{
  "policy_id": "hs-2025-XXXX",
  "title": "2025년 경기도 청소년 생활장학금 지원사업 안내",
  "category": "복지",
  "lifecycle": [
    "청년"
  ],
  "beneficiary": "본인",
  "benefit": "생활장학금 지원",
  "deadline": "2025-03-28",
  "required_docs": [
    "공고 확인 필요"
  ],
  "contact": "남양읍",
  "exclusions": [],
  "apply_channel": "공고 확인 필요",
  "conditions": {
    "age": {
      "min": 13,
      "max": 18
    },
    "household": [
      "제한없음"
    ]
  },
  "manual_conditions": [
    {
      "label": "국민기초생활보장수급자, 법정 차상위계층, 법정 한부모(조손)가족 지원대상자",
      "hint": "서류로 확인"
    }
  ],
  "source_url": "https://www.hscity.go.kr/byeongjeom/user/bbs/BD_selectBbs.do?q_bbsCode=1048&q_bbscttSn=20250311203422028&q_deptCode=57400150000&q_searchWhereTy=&q_searchVal=",
  "review": {
    "parsed_by": "A",
    "reviewed_by": "",
    "reviewed_at": "2026-08-12",
    "checklist": {
      "conditions": false,
      "deadline": false,
      "benefit": false,
      "required_docs": false,
      "apply_channel": false,
      "source_url": false,
      "conditions_complete": false
    }
  }
}