{
  "policy_id": "hs-2026-2673",
  "title": "2026년 화성시 청년 내:일(job)응원금 지원사업 (2차 추가모집)",
  "category": "일자리",
  "lifecycle": [
    "청년"
  ],
  "beneficiary": "본인",
  "benefit": "근속장려금 1인당 최대 100만원 화성지역화폐 지급 (1차 50만원 9월말 / 2차 50만원 11월)",
  "conditions": {
    "age": {
      "min": 19,
      "max": 39
    },
    "residence_months": {
      "min": 6
    },
    "household": [
      "제한없음"
    ]
  },
  "manual_conditions": [
    {
      "label": "화성시 관내 중소기업(상시근로자 5인 이상)에 2025년 1월 이후 신규 취업",
      "hint": "재직증명서, 기업 사업자등록증 사본, 중소기업 확인서로 확인"
    },
    {
      "label": "2026년 4월 1일 기준 6개월 이상 근속 중 (2025.1.1~2025.10.1 입사자)",
      "hint": "근로계약서 및 재직증명서로 확인"
    },
    {
      "label": "기간의 정함이 없는 근로계약 체결",
      "hint": "근로계약서에 정년까지임이 명시적으로 확인되어야 함"
    },
    {
      "label": "4대보험 가입 및 주 36시간 이상 근로",
      "hint": "4대보험 가입내역 확인서, 근로계약서상 월 소정근로시간 기준(연장근무 제외)"
    },
    {
      "label": "직장가입자 건강보험료 본인부담금 월 129,141원 이하",
      "hint": "2026년 1~3월 평균, 장기요양보험료 제외, 청년 단독 기준 — 건강보험료 납부확인서로 확인"
    },
    {
      "label": "대한민국 국적 보유자",
      "hint": "주민등록초본으로 확인"
    }
  ],
  "exclusions": [
    "기업 대표자(사용자) 및 사업주의 배우자·직계존비속",
    "휴직자, 해외파견자, 병역복무 중인 자",
    "다단계 판매업, 외근 영업직·판매직(방문 화장품·보험 판매 등)",
    "파견근로자 및 근로자 공급사업 종사자(용역업체 포함)",
    "유흥·향락·사행 업종 종사자",
    "최근 3년간 정부·지자체 유사사업 기수혜자 (청년내일저축계좌, 청년 내일채움공제, 일자리 도약장려금, 경기도 청년노동자통장·청년복지포인트 등)",
    "유사한 근속 장려 및 장기재직 성격의 현금성 지원 수령 중인 자"
  ],
  "deadline": "2026-08-14",
  "apply_channel": "온라인 신청 — 잡아바어플라이(apply.jobaba.net)",
  "required_docs": [
    "신청자서약서 [공고문 서식①] — 본인 서명(또는 인) 누락 시 미제출 간주",
    "주민등록초본 (주민등록번호 뒷자리 및 주소변동 내역 전부 포함, 정부24·행정복지센터, 잡아바 마이데이터 대체 가능)",
    "가족관계증명서(일반) — 본인 기준 (대법원 전자가족관계등록시스템·행정복지센터)",
    "근로계약서 사본 — 사업자 직인 날인, 기간의 정함이 없음이 확인되어야 함 (근무처)",
    "재직증명서 — 사업자 직인 날인 (근무처)",
    "건강보험료 납부확인서 — 2026년 1~3월분, 세부 보험 '건강보험료' 선택 (건강보험공단)",
    "4대보험 가입내역 확인서 — 주민등록번호 뒷자리 포함 (정부24)",
    "기업 사업자등록증 사본 또는 사업자등록증명원 — 사업장 소재지가 화성시인 경우 (근무처)",
    "중소기업 확인서 — 타 서류 대체 불가, 공고일 기준 유효기간 내 (중소기업 현황정보시스템)"
  ],
  "verify_required": [
    "residence_months"
  ],
  "contact": "화성시 청년청소년과 청년지원팀 031-5189-6217",
  "source_url": "https://www.hscity.go.kr/town/user/bbs/BD_selectBbs.do?q_bbsCode=1048&q_bbscttSn=20260415091943924",
  "review": {
    "parsed_by": "D",
    "reviewed_by": "A",
    "reviewed_at": "2026-08-10",
    "checklist": {
      "conditions": true,
      "deadline": true,
      "benefit": true,
      "required_docs": true,
      "apply_channel": true,
      "source_url": true,
      "conditions_complete": true,
      "exclusions": true
    }
  }
}